{
  "name": "qwen3.5-4b-code-balanced",
  "version": "1.0.0",
  "description": "Balanced code forge for Qwen3.5-4B. 30% entropy pruning, 3 cycles, GGUF output for MacBook and iPhone.",
  "author": "continuum-ai",
  "tags": ["code", "qwen3.5", "4b", "balanced", "macbook", "iphone", "forge-alloy"],
  "license": "apache-2.0",

  "source": {
    "baseModel": "Qwen/Qwen3.5-4B",
    "architecture": "qwen3_5",
    "isMoE": false
  },

  "stages": [
    {
      "type": "prune",
      "strategy": "entropy",
      "level": 0.3,
      "minHeadsPerLayer": 4,
      "minKvHeadsPerLayer": 2,
      "analysisSteps": 200
    },
    {
      "type": "train",
      "domain": "code",
      "dataset": "m-a-p/CodeFeedback-Filtered-Instruction",
      "steps": 1000,
      "learningRate": "2e-4",
      "batchSize": 4,
      "gradientAccumulation": 4,
      "scheduler": "cosine",
      "warmupRatio": 0.03,
      "weightDecay": 0.01,
      "maxGradientNorm": 1.0,
      "precision": "bf16",
      "sequenceLength": 2048,
      "optimizations": ["flash_attention", "gradient_checkpointing"]
    },
    {
      "type": "compact",
      "deadThreshold": 0.1,
      "dormantThreshold": 0.2,
      "lowThreshold": 0.3,
      "mediumThreshold": 0.5,
      "highThreshold": 0.7,
      "enableQuantization": true
    },
    {
      "type": "quant",
      "format": "gguf",
      "quantTypes": ["Q4_K_M", "Q8_0"],
      "deviceTargets": ["macbookair", "iphone", "rtx3090"]
    },
    {
      "type": "eval",
      "benchmarks": [
        { "name": "humaneval", "submitToLeaderboard": true },
        { "name": "mmlu", "subset": "mmlu-pro", "nShot": 5, "submitToLeaderboard": false },
        { "name": "gsm8k", "nShot": 8, "submitToLeaderboard": false }
      ],
      "passingThreshold": 60,
      "compareToBase": true
    },
    {
      "type": "publish",
      "org": "continuum-ai",
      "repoNameTemplate": "{base}-{domain}-forged",
      "includeAlloy": true,
      "cardFromBenchmarks": true,
      "tags": ["continuum", "forged", "experiential-plasticity", "head-pruning", "forge-alloy"],
      "private": false
    }
  ],

  "cycles": 3,

  "hardware": {
    "minVramGb": 8,
    "recommendedVramGb": 24,
    "estimatedDurationMinutes": 45,
    "supportsCPU": false,
    "testedOn": ["RTX 5090", "RTX 4090"]
  },

  "outputs": {
    "produces": [
      { "type": "safetensors", "description": "Forged base weights (full precision)" },
      { "type": "gguf", "description": "Q4_K_M for MacBook Air, Q8_0 for desktop" },
      { "type": "model-card", "description": "Auto-generated from benchmark results" },
      { "type": "alloy", "description": "This alloy (for reproducibility)" }
    ]
  },

  "results": {
    "completedAt": "2026-03-28T14:32:00Z",
    "durationMinutes": 42.3,
    "baselinePerplexity": 3.04,
    "finalPerplexity": 2.31,
    "improvementPct": 24.0,
    "finalSizeGb": 8.0,
    "finalParams": "3.8B",

    "benchmarks": [
      {
        "name": "humaneval",
        "metrics": {
          "passing": 63,
          "total": 85,
          "score": 74.1,
          "hardPassing": 12,
          "hardTotal": 17,
          "hardScore": 70.6
        },
        "submittedToLeaderboard": true,
        "resultHash": "sha256:a1b2c3d4e5f6..."
      },
      {
        "name": "mmlu",
        "subset": "mmlu-pro",
        "metrics": {
          "accuracy": 68.5,
          "nShot": 5,
          "baselineAccuracy": 62.1,
          "improvement": 6.4
        },
        "submittedToLeaderboard": false
      },
      {
        "name": "gsm8k",
        "metrics": {
          "accuracy": 71.2,
          "nShot": 8,
          "baselineAccuracy": 65.8,
          "improvement": 5.4
        },
        "submittedToLeaderboard": false
      }
    ],

    "hardwareVerified": [
      {
        "device": "RTX 5090 32GB",
        "format": "fp16",
        "sizeGb": 8.0,
        "tokensPerSec": 174.0,
        "memoryUsageGb": 9.2,
        "verified": true
      },
      {
        "device": "MacBook Pro 32GB M1",
        "format": "Q8_0",
        "sizeGb": 4.2,
        "tokensPerSec": 31.0,
        "memoryUsageGb": 5.1,
        "verified": true
      },
      {
        "device": "MacBook Air 8GB",
        "format": "Q4_K_M",
        "sizeGb": 2.6,
        "tokensPerSec": 12.0,
        "memoryUsageGb": 3.8,
        "verified": true
      },
      {
        "device": "iPhone 17",
        "format": "Q4_K_M",
        "sizeGb": 2.6,
        "tokensPerSec": 8.0,
        "memoryUsageGb": 3.2,
        "verified": true
      }
    ],

    "samples": [
      {
        "label": "Merge Sort",
        "prompt": "def merge_sort(arr):",
        "completion": "def merge_sort(arr):\n    if len(arr) <= 1:\n        return arr\n    mid = len(arr) // 2\n    left = merge_sort(arr[:mid])\n    right = merge_sort(arr[mid:])\n    return merge(left, right)\n\ndef merge(left, right):\n    result = []\n    i = j = 0\n    while i < len(left) and j < len(right):\n        if left[i] <= right[j]:\n            result.append(left[i])\n            i += 1\n        else:\n            result.append(right[j])\n            j += 1\n    result.extend(left[i:])\n    result.extend(right[j:])\n    return result",
        "baselineCompletion": "def merge_sort(arr):\n    if len(arr) <= 1:\n        return arr\n    mid = len(arr) // 2\n    left = merge_sort(arr[:mid])\n    right = merge_sort(arr[mid:])\n    # incomplete merge logic\n    return left + right"
      },
      {
        "label": "Binary Search Tree",
        "prompt": "class BSTNode:\n    \"\"\"Implement a binary search tree with insert and search.\"\"\"",
        "completion": "class BSTNode:\n    \"\"\"Implement a binary search tree with insert and search.\"\"\"\n    def __init__(self, val):\n        self.val = val\n        self.left = None\n        self.right = None\n\n    def insert(self, val):\n        if val < self.val:\n            if self.left is None:\n                self.left = BSTNode(val)\n            else:\n                self.left.insert(val)\n        else:\n            if self.right is None:\n                self.right = BSTNode(val)\n            else:\n                self.right.insert(val)\n\n    def search(self, val):\n        if val == self.val:\n            return True\n        elif val < self.val and self.left:\n            return self.left.search(val)\n        elif val > self.val and self.right:\n            return self.right.search(val)\n        return False"
      }
    ],

    "integrity": {
      "trustLevel": "self-attested",
      "code": {
        "runner": "sentinel-ai/forge_model",
        "version": "0.9.2",
        "binaryHash": "sha256:a1b2c3d4e5f6a7b8c9d0e1f2a3b4c5d6e7f8a9b0c1d2e3f4a5b6c7d8e9f0a1b2",
        "sourceHash": "sha256:f0e1d2c3b4a5968778695a4b3c2d1e0f1a2b3c4d5e6f7a8b9c0d1e2f3a4b5c6d",
        "commit": "09bb60f",
        "environment": "PyTorch 2.4.1, CUDA 12.6, Python 3.11.8, Ubuntu 22.04",
        "environmentHash": "sha256:deadbeefcafe1234567890abcdef1234567890abcdef1234567890abcdef1234"
      },
      "modelHash": "sha256:7f8a9b2c3d4e5f6a1b2c3d4e5f6a7b8c9d0e1f2a3b4c5d6e7f8a9b0c1d2e3f4",
      "alloyHash": "sha256:1a2b3c4d5e6f7a8b9c0d1e2f3a4b5c6d7e8f9a0b1c2d3e4f5a6b7c8d9e0f1a2b",
      "datasets": [
        {
          "name": "humaneval",
          "version": "1.0.0",
          "hash": "sha256:abc123def456789abc123def456789abc123def456789abc123def456789abcd",
          "source": "https://github.com/openai/human-eval"
        },
        {
          "name": "mmlu-pro",
          "version": "2024.1",
          "hash": "sha256:def456abc789012def456abc789012def456abc789012def456abc789012defg",
          "source": "https://huggingface.co/datasets/TIGER-Lab/MMLU-Pro"
        },
        {
          "name": "gsm8k",
          "version": "1.0.0",
          "hash": "sha256:789abc012def345789abc012def345789abc012def345789abc012def345789a"
        }
      ],
      "certifications": [
        {
          "adapter": "forge-alloy/humaneval",
          "version": "1.0.0",
          "domain": "benchmark:humaneval",
          "result": {
            "passing": 63,
            "total": 85,
            "score": 74.1,
            "harnessHash": "sha256:eval789abc012def345789abc012def345789abc012def345789abc012def345"
          },
          "adapterHash": "sha256:adapter123def456789abc012def345789abc012def345789abc012def345789",
          "sourceRepo": "https://github.com/CambrianTech/forge-alloy",
          "commit": "abc123def456789",
          "attestedAt": "2026-03-28T14:30:00Z"
        },
        {
          "adapter": "forge-alloy/inference-perf",
          "version": "1.0.0",
          "domain": "hardware:inference",
          "result": {
            "device": "RTX 5090 32GB",
            "tokensPerSec": 174,
            "memoryUsageGb": 9.2,
            "format": "fp16"
          },
          "adapterHash": "sha256:perf456def789abc012def345789abc012def345789abc012def345789abc01",
          "sourceRepo": "https://github.com/CambrianTech/forge-alloy",
          "commit": "abc123def456789",
          "attestedAt": "2026-03-28T14:31:00Z"
        }
      ],
      "attestedAt": "2026-03-28T14:32:00Z"
    }
  },

  "forgedModelIds": [
    "continuum-ai/qwen3.5-4b-code-forged",
    "continuum-ai/qwen3.5-4b-code-forged-GGUF"
  ]
}
